### ISSUE TITLE
Add DNS lookup of hostnames in socket addresses

### ISSUE THREAD

**Issue by fsimonis** [precice/precice#1676]
**Please describe the problem you are trying to solve.**

Some setups require addressing a participant via name resolution instead of simple IP.
A good example for this are kubernetes networks, where pods represent named services.

The connecting participant needs to resolve the name of the service to an IP, which can then be used to address the service.

**Describe the solution you propose.**

```
<m2n:sockets acceptor="Solid" connector="Fluid" address="SolidService" resolve-dns="True" />
```
We would first run name resolution onto the passed address and then use the IP to connect.

**Describe alternatives you've considered**

Externally resolve the name and modify the configuration file using a script before running the simulation.

**Additional context**

**Comment by ostodieck** [comment]
Hi @fsimonis - thanks for posting this. 

I tried to implement the alternative solution you mention as this would allow me to route communications though the istio service mesh (my prefered solution). Unfortunately no success - see details below...
Any ideas how I could investigate this problem further?
____________

Precice configs (all else similar to the Partitioned elastic beam tutorial )
Calculix1:
```
<m2n:sockets from="Calculix1" to="Calculix2" exchange-directory="../../pvc_shared_copy" network="eth0" port="50062" enforce-gather-scatter="1"/>
```
Calculix2:
```
<m2n:sockets from="Calculix1" to="Calculix2" exchange-directory="../../pvc_shared" network="eth0" port="50062" enforce-gather-scatter="1"/>
```
Note that here:
1) all precice communication should go though port 50062, which is being monitored by the istio sidecars. 
So outbound comms should go from precice container (1) to the istio sidecar in the same pod (2), which checks authorizations and then routes it to the appropriate k8s service (3), which routes to the istio sidecar in the target pod (4), which routes to the target precice workload (5) (from what I understand!). 
2) the ../../pvc_shared is a shared nfs-rwx-storage volume, which allows exchange of the connection files.

*The manual step:*
Once Calculix 2 has generated the connection file in "../../pvc_shared", I copy an edited version to the "../../pvc_shared_copy", where the Calculix 2 container IP is replaced with the Calculix k8s service cluster IP. 

From the debug logs below, I understand that Calculix1 sends a request to the k8s service, but this doesn't seem to be picked-up by the Calculix 2 process. 

So then I checked that the TCP connections from the workloads to the k8s services for participants 1 and 2 are open by using netcat to send text messages between participants - this works fine as shown below. But the precice process just hangs at the connection step (without any debug messages output by precice to indicate problem). 

Netcat test:
![precice-](https://github.com/precice/precice/assets/55671906/4a0740bf-822d-4fe7-b3ae-a09aaa7f5f96)

end of debug log from Calculix1:
```
...
(0) 17:01:00 [impl::SolverInterfaceImpl]:277 in initialize: Setting up primary communication to coupling partner/s
(0) 17:01:00 [impl::SolverInterfaceImpl]:284 in initialize: Awaiting primary connection from Calculix2
(0) 17:01:00 [utils::Events]:40 in start: Started event initialize/m2n.requestPrimaryRankConnection
(0) 17:01:00 [m2n::M2N]:69 in requestPrimaryRankConnection: Request primary connection
(0) 17:01:00 [com::ConnectionInfoPublisher]:64 in read: Waiting for connection file "../../pvc_shared_copy/precice-run/Calculix2-Calculix1/b4/c54bec8c1e5073ba6e8fc7d0328f19"
(0) 17:01:00 [com::ConnectionInfoPublisher]:70 in read: Found connection file "../../pvc_shared_copy/precice-run/Calculix2-Calculix1/b4/c54bec8c1e5073ba6e8fc7d0328f19"
(0) 17:01:00 [com::SocketCommunication]:211 in requestConnection: Request connection to 10.245.92.195:50062
(0) 17:01:00 [com::SocketCommunication]:240 in requestConnection: Requested connection to 10.245.92.195:50062
```

end of debug log from Calculix2:
```
...
(0) 17:00:57 [impl::SolverInterfaceImpl]:277 in initialize: Setting up primary communication to coupling partner/s
(0) 17:00:57 [impl::SolverInterfaceImpl]:284 in initialize: Establishing primary connection to Calculix1
(0) 17:00:57 [com::SocketCommunication]:382 in prepareEstablishment: Creating connection exchange directory ../../pvc_shared/precice-run/Calculix2-Calculix1
(0) 17:00:57 [utils::Events]:40 in start: Started event initialize/m2n.acceptPrimaryRankConnection
(0) 17:00:57 [m2n::M2N]:50 in acceptPrimaryRankConnection: Accept primary connection
(0) 17:00:57 [com::SocketCommunication]:773 in getIpAddress: Looking for IP address of network "eth0"
(0) 17:00:57 [com::SocketCommunication]:793 in getIpAddress: Detected network IP address of interface "eth0": 10.244.0.217.
(0) 17:00:57 [com::ConnectionInfoPublisher]:123 in write: Writing temporary connection file "../../pvc_shared/precice-run/Calculix2-Calculix1/b4/c54bec8c1e5073ba6e8fc7d0328f19~"
(0) 17:00:57 [com::ConnectionInfoPublisher]:137 in write: Publishing connection file "../../pvc_shared/precice-run/Calculix2-Calculix1/b4/c54bec8c1e5073ba6e8fc7d0328f19"
(0) 17:00:57 [com::SocketCommunication]:87 in acceptConnection: Accept connection at 10.244.0.217:50062
```

**Comment by fsimonis** [comment]
@ostodieck Looking at your setup and the provided description, the workaround should work.

Given that the requestor side doesn't find the connection file, there are a few things coming to mind:

* maybe the copy in the manual step doesn't preserve the folder structure.
* the file system may need an additional trigger to wake up the waiting process. Try `touch`ing all files in the destination folder after the copy.
* the paths are all relative. Try using absolute paths to rule out mismatched starting directories.

Have you tried this locally somehow to check if the scripts work?

**Comment by ostodieck** [comment]
I don't think the problem is with the file system, as the requester finds the connection file and requests the connection to the service (see last three lines of the Calculix 1 debug log) - that request seems to never arrive at the Acceptor...

**Comment by fsimonis** [comment]
Thanks for pointing me back to the logs. I totally misread them.

Do I understand correctly that inside the containers, you only have a single eth0 interface, which is connected to those sidecart thingies responsible for the routing?

Do you have access to the logs of each of those proxies? Seems like the connection request is blocked somewhere, which should pop up in some log along the routing chain.

**Comment by ostodieck** [comment]
> Do I understand correctly that inside the containers, you only have a single eth0 interface, which is connected to those sidecart thingies responsible for the routing?

Yes - [this article](https://tetrate.io/blog/what-is-istio-and-why-does-kubernetes-need-it) includes a good figure of a typical architecture, although in this case we only have 1 pod per service. 
 
> Do you have access to the logs of each of those proxies? Seems like the connection request is blocked somewhere, which should pop up in some log along the routing chain.

I first checked the istio proxy logs, but there is no record of the preCICE connection there, so I am thinking that it might fail in the very early stages before it gets logged... 
I then experimented with running tcpdump in the Calculix1 container (called "beam-1-xxx" in the DNS resolution) to see what TCP connections were actually initiated by the Requestor. Below are the results for different tests, showing the first few TCP calls with DNS resolution, where `beam-2.auth0xxx.svc.cluster.local` is the Acceptor Service address.

From the working netcat example (4) below, it looks like there should be 2 steps in the connection: 
1) a connection from the Requestor to the Acceptor Service
`beam-2.auth0xxx.svc.cluster.local.50062  < > beam-1-6c4f5c7ff5-7lhf8.59280`
2) a connection from the Requestor (new port) to the Acceptor pod instance.   
`10-244-0-211.beam-2.auth0xxx.svc.cluster.local.50062 < > beam-1-6c4f5c7ff5-7lhf8.34566`

In the successfull preCICE test (2) below, the process skips connection 1) and goes to connection 2) directly. 
However, the hanging preCICE test (3) stops after the first connection.  
Could it be that the "beam-1" host is not resolving the IP for the Acceptor endpoint from the Acceptor Service IP calls? 

There  may be more relevant information in the content of the TCP calls, but I am not sure how to extract this data in a useful format right now... I tried  tcpdump -A, but since we are not working with ascii data the output is not very meaningful! 
Any ideas?
_____________________

*First few lines of tcpdump -i any output for tests 1) to 4):*

(1) A local preCICE setup that works using a single m2n port 50061. The Requestor port 42230 is random, but the Acceptor is fixed to port 50061:
```
10:32:54.507876 IP 127.0.0.1.42230 > 127.0.0.1.50061: Flags [S], seq 4119457765, win 65495, options [mss 65495,sackOK,TS val 927468889 ecr 0,nop,wscale 7], length 0
10:32:54.507882 IP 127.0.0.1.50061 > 127.0.0.1.42230: Flags [S.], seq 1070079114, ack 4119457766, win 65483, options [mss 65495,sackOK,TS val 927468889 ecr 927468889,nop,wscale 7], length 0
10:32:54.507889 IP 127.0.0.1.42230 > 127.0.0.1.50061: Flags [.], ack 1, win 512, options [nop,nop,TS val 927468889 ecr 927468889], length 0
10:32:54.507955 IP 127.0.0.1.42230 > 127.0.0.1.50061: Flags [P.], seq 1:5, ack 1, win 512, options [nop,nop,TS val 927468889 ecr 927468889], length 4
10:32:54.507975 IP 127.0.0.1.50061 > 127.0.0.1.42230: Flags [.], ack 5, win 512, options [nop,nop,TS val 927468889 ecr 927468889], length 0
10:32:54.507989 IP 127.0.0.1.50061 > 127.0.0.1.42230: Flags [P.], seq 1:5, ack 5, win 512, options [nop,nop,TS val 927468889 ecr 927468889], length 4
10:32:54.508007 IP 127.0.0.1.42230 > 127.0.0.1.50061: Flags [.], ack 5, win 512, options [nop,nop,TS val 927468889 ecr 927468889], length 0
```

(2) A k8s preCICE setup that works, but requires setting a single m2n port 50061 and excluding that port from monitoring by istio in the k8s deployment definition (as per [original post here](https://preCICE.discourse.group/t/how-to-configure-preCICE-communication-on-kubernetes-with-tcp-port-access-control/1451/1)). The IP 10.244.0.172 is that of the Calculix2 (Acceptor) container, which is the IP that preCICE writes to the connection file:
```
14:41:05.064912 IP beam-1-6c4f5c7ff5-cvghd.43404 > 10-244-0-172.beam-2.auth0xxx.svc.cluster.local.50061: Flags [S], seq 3938652545, win 64240, options [mss 1460,sackOK,TS val 3064649763 ecr 0,nop,wscale 7], length 0
14:41:05.065003 IP 10-244-0-172.beam-2.auth0xxx.svc.cluster.local.50061 > beam-1-6c4f5c7ff5-cvghd.43404: Flags [S.], seq 2709539965, ack 3938652546, win 65160, options [mss 1460,sackOK,TS val 2321282980 ecr 3064649763,nop,wscale 7], length 0
14:41:05.065017 IP beam-1-6c4f5c7ff5-cvghd.43404 > 10-244-0-172.beam-2.auth0xxx.svc.cluster.local.50061: Flags [.], ack 1, win 502, options [nop,nop,TS val 3064649763 ecr 2321282980], length 0
14:41:05.065073 IP beam-1-6c4f5c7ff5-cvghd.43404 > 10-244-0-172.beam-2.auth0xxx.svc.cluster.local.50061: Flags [P.], seq 1:5, ack 1, win 502, options [nop,nop,TS val 3064649763 ecr 2321282980], length 4
14:41:05.065090 IP 10-244-0-172.beam-2.auth0xxx.svc.cluster.local.50061 > beam-1-6c4f5c7ff5-cvghd.43404: Flags [.], ack 5, win 510, options [nop,nop,TS val 2321282980 ecr 3064649763], length 0
14:41:05.065634 IP 10-244-0-172.beam-2.auth0xxx.svc.cluster.local.50061 > beam-1-6c4f5c7ff5-cvghd.43404: Flags [P.], seq 1:5, ack 5, win 510, options [nop,nop,TS val 2321282981 ecr 3064649763], length 4
```

(3) A k8s preCICE setup that hangs at the connection step as described [above](https://github.com/preCICE/preCICE/issues/1676#issuecomment-1627388182), when setting a single m2n port 50062 (not excluded from monitoring by istio):
```
5:37:46.629341 IP beam-1-6c4f5c7ff5-7lhf8.57340 > localhost.15001: Flags [S], seq 1351880429, win 64240, options [mss 1460,sackOK,TS val 1837831118 ecr 0,nop,wscale 7], length 0
15:37:46.629367 IP beam-2.auth0xxx.svc.cluster.local.50062 > beam-1-6c4f5c7ff5-7lhf8.57340: Flags [S.], seq 4158878183, ack 1351880430, win 65483, options [mss 65495,sackOK,TS val 3201900650 ecr 1837831118,nop,wscale 7], length 0
15:37:46.629382 IP beam-1-6c4f5c7ff5-7lhf8.57340 > localhost.15001: Flags [.], ack 4158878184, win 502, options [nop,nop,TS val 1837831118 ecr 3201900650], length 0
15:37:46.630139 IP beam-1-6c4f5c7ff5-7lhf8.57340 > localhost.15001: Flags [P.], seq 0:4, ack 1, win 502, options [nop,nop,TS val 1837831119 ecr 3201900650], length 4
15:37:46.630161 IP beam-2.auth0xxx.svc.cluster.local.50062 > beam-1-6c4f5c7ff5-7lhf8.57340: Flags [.], ack 5, win 512, options [nop,nop,TS val 3201900651 ecr 1837831119], length 0
(no futher relevant TCP calls)
```

(4) A k8s test with netcat that works using port 50062 (not excluded from monitoring by istio):
```
16:52:43.591830 IP beam-1-6c4f5c7ff5-7lhf8.59280 > localhost.15001: Flags [S], seq 523921532, win 64240, options [mss 1460,sackOK,TS val 1842328081 ecr 0,nop,wscale 7], length 0
16:52:43.591862 IP beam-2.auth0xxx.svc.cluster.local.50062 > beam-1-6c4f5c7ff5-7lhf8.59280: Flags [S.], seq 3071055617, ack 523921533, win 65483, options [mss 65495,sackOK,TS val 3206397613 ecr 1842328081,nop,wscale 7], length 0
16:52:43.591880 IP beam-1-6c4f5c7ff5-7lhf8.59280 > localhost.15001: Flags [.], ack 3071055618, win 502, options [nop,nop,TS val 1842328081 ecr 3206397613], length 0

[TCP calls to/from control plane IPs]

16:52:45.788874 IP beam-1-6c4f5c7ff5-7lhf8.59280 > localhost.15001: Flags [P.], seq 0:5, ack 1, win 502, options [nop,nop,TS val 1842330278 ecr 3206397613], length 5
16:52:45.788905 IP beam-2.auth0xxx.svc.cluster.local.50062 > beam-1-6c4f5c7ff5-7lhf8.59280: Flags [.], ack 6, win 512, options [nop,nop,TS val 3206399810 ecr 1842330278], length 0
16:52:45.789486 IP beam-1-6c4f5c7ff5-7lhf8.34566 > 10-244-0-211.beam-2.auth0xxx.svc.cluster.local.50062: Flags [S], seq 2040221155, win 64240, options [mss 1460,sackOK,TS val 1877380285 ecr 0,nop,wscale 7], length 0
16:52:45.789575 IP 10-244-0-211.beam-2.auth0xxx.svc.cluster.local.50062 > beam-1-6c4f5c7ff5-7lhf8.34566: Flags [S.], seq 3564702486, ack 2040221156, win 65160, options [mss 1460,sackOK,TS val 3479933168 ecr 1877380285,nop,wscale 7], length 0
16:52:45.789595 IP beam-1-6c4f5c7ff5-7lhf8.34566 > 10-244-0-211.beam-2.auth0xxx.svc.cluster.local.50062: Flags [.], ack 1, win 502, options [nop,nop,TS val 1877380286 ecr 3479933168], length 0
16:52:45.789990 IP beam-1-6c4f5c7ff5-7lhf8.34566 > 10-244-0-211.beam-2.auth0xxx.svc.cluster.local.50062: Flags [P.], seq 1:2228, ack 1, win 502, options [nop,nop,TS val 1877380286 ecr 3479933168], length 2227
```

**Comment by ostodieck** [comment]
One more detail that might not have been obvious from the above: 
Manually calling the pod IP endpoint directly in example (3) above also fails, so the first step in the connection (i.e. connecting to the Service) cannot be skipped either.

One more idea that just comes to mind: 
If the first connection to the Service can be established manually, then I assume it would be possible to get the process above to work, since preCICE is already able to establish the endpoint connection as per example (2) ...

**Comment by fsimonis** [comment]
Looking at this problem from a preCICE/Solver standpoint:

* the acceptor needs to listen to a port on a given interface
* the requestor needs to connect to the other solver via a proxy

Using proxies doesn't change anything for the acceptor.
The requestor, however, cannot use the IP of the solver but needs to go through a local proxy.
If we assume that the ports remain consistent, then we can add a `service` attribute to the m2n config, which allows the requestor to resolve a service name to an IP and then connect to it. In this case, the service would resolve to the IP of the local proxy in the pod of the connector.

An upside of this system is that the connection info file is not required anymore, as the DNS takes over this role.

In schematic form:
![istio](https://github.com/user-attachments/assets/412d0350-0f49-44bc-a079-09f38171c5d6)

Supporting this for `enforce-gather-scatter="0"` is a completely different story though.
We either need to enforce sequential ports, or use connection files where we write the accepting port of the rank.

In terms of istio, this requires proxying port ranges, which seems to be unsupported. Alternative would be to list ports manually.

The config for the partitioned beam problem should then look like this. Does this make sense @ostodieck?

```xml
<m2n:sockets from="Calculix1" to="Calculix2" network="eth0" service="beam-1-6c4f5c7ff5-7lhf8.59280" port="50062" enforce-gather-scatter="1"/>
```
